{
  "schemaVersion": "1.0.0",
  "courseId": "ztle-hardware-cpu",
  "lessonId": "zcle-cpu-pilot-01",
  "title": "What is CPU?",
  "language": "hi-Latn",
  "sourceOfTruth": {
    "repository": "ALONE-616/ZTLE",
    "ref": "beta",
    "paths": [
      "Hardware/courses/cpu/COURSE_MAP.md",
      "Hardware/courses/cpu/part-01-fundamentals.md",
      "Hardware/courses/cpu/part-02-working-and-use.md"
    ]
  },
  "estimatedAudience": "Beginner IT learners",
  "status": "prototype-not-published",
  "width": 1920,
  "height": 1080,
  "durationMs": 307425,
  "audio": {
    "src": "../assets/audio/cpu-narration-preview.mp3",
    "format": "audio/mpeg",
    "role": "master-clock",
    "voiceQuality": "robotic-placeholder",
    "note": "Replace with professionally recorded Hinglish narration before publication."
  },
  "captions": {
    "source": "scene.narration.text",
    "granularity": "scene",
    "status": "prototype"
  },
  "scenes": [
    {
      "id": "scene-01",
      "order": 1,
      "part": "01",
      "title": "What is CPU?",
      "mode": "2.5D",
      "visualTemplate": "hero",
      "narration": {
        "text": "Aaj hum CPU ko samjhenge: ye kya hai, instructions kaise process karta hai, aur computer ki performance mein iska role kya hota hai. Ek simple example se shuru karte hain: jab aap browser open karte hain, background mein CPU program instructions execute karta hai.",
        "startMs": 700,
        "endMs": 22564,
        "voiceType": "offline-espeak-placeholder"
      },
      "startMs": 0,
      "endMs": 23564,
      "durationMs": 23564,
      "headline": "Inside the computer",
      "kicker": "CENTRAL PROCESSING UNIT",
      "labels": [
        "Execute instructions",
        "Run applications",
        "Control tasks"
      ],
      "accessibility": {
        "visualDescription": "Stylized CPU package with animated concentric circuitry."
      },
      "cues": [
        {
          "id": "enter",
          "atMs": 0,
          "action": "reveal",
          "target": "headline"
        },
        {
          "id": "cue-01",
          "atMs": 5891,
          "action": "highlight",
          "target": "Execute instructions"
        },
        {
          "id": "cue-02",
          "atMs": 12725,
          "action": "highlight",
          "target": "Run applications"
        },
        {
          "id": "cue-03",
          "atMs": 19558,
          "action": "highlight",
          "target": "Control tasks"
        }
      ]
    },
    {
      "id": "scene-02",
      "order": 2,
      "part": "01",
      "title": "CPU ka full form",
      "mode": "2D",
      "visualTemplate": "definition",
      "narration": {
        "text": "CPU ka full form hai Central Processing Unit. Ye computer ka general purpose processing component hai. Operating system, applications aur calculations ke bahut se instructions CPU par execute hote hain. Lekin CPU akela poora computer nahi hai.",
        "startMs": 24264,
        "endMs": 44346,
        "voiceType": "offline-espeak-placeholder"
      },
      "startMs": 23564,
      "endMs": 45346,
      "durationMs": 21782,
      "headline": "Central Processing Unit",
      "kicker": "CPU = GENERAL-PURPOSE PROCESSOR",
      "labels": [
        "Central",
        "Processing",
        "Unit"
      ],
      "accessibility": {
        "visualDescription": "Animated three-part CPU acronym and explanatory cards."
      },
      "cues": [
        {
          "id": "enter",
          "atMs": 0,
          "action": "reveal",
          "target": "headline"
        },
        {
          "id": "cue-01",
          "atMs": 5446,
          "action": "highlight",
          "target": "Central"
        },
        {
          "id": "cue-02",
          "atMs": 11762,
          "action": "highlight",
          "target": "Processing"
        },
        {
          "id": "cue-03",
          "atMs": 18079,
          "action": "highlight",
          "target": "Unit"
        }
      ]
    },
    {
      "id": "scene-03",
      "order": 3,
      "part": "01",
      "title": "CPU akela nahi kaam karta",
      "mode": "2D",
      "visualTemplate": "ecosystem",
      "narration": {
        "text": "CPU ko computer ka brain kehna popular shortcut hai. Technically, computing mein RAM, storage, input output aur software sab milkar kaam karte hain. CPU instructions execute karta hai, jabki baaki components data aur services available karvate hain.",
        "startMs": 46046,
        "endMs": 66816,
        "voiceType": "offline-espeak-placeholder"
      },
      "startMs": 45346,
      "endMs": 67816,
      "durationMs": 22470,
      "headline": "One component. One system.",
      "kicker": "SYSTEM VIEW",
      "labels": [
        "Applications",
        "CPU",
        "RAM",
        "Storage"
      ],
      "accessibility": {
        "visualDescription": "CPU at center connected to applications memory and storage."
      },
      "cues": [
        {
          "id": "enter",
          "atMs": 0,
          "action": "reveal",
          "target": "headline"
        },
        {
          "id": "cue-01",
          "atMs": 5618,
          "action": "highlight",
          "target": "Applications"
        },
        {
          "id": "cue-02",
          "atMs": 9962,
          "action": "highlight",
          "target": "CPU"
        },
        {
          "id": "cue-03",
          "atMs": 14306,
          "action": "highlight",
          "target": "RAM"
        },
        {
          "id": "cue-04",
          "atMs": 18650,
          "action": "highlight",
          "target": "Storage"
        }
      ]
    },
    {
      "id": "scene-04",
      "order": 4,
      "part": "01",
      "title": "Fetch Decode Execute",
      "mode": "2D",
      "visualTemplate": "fde",
      "narration": {
        "text": "CPU ki basic working samajhne ke liye fetch, decode aur execute model useful hai. Fetch mein instruction li jaati hai. Decode mein operation samjha jaata hai. Execute mein required calculation ya action perform hota hai. Real processors mein pipeline aur overlap bhi hote hain.",
        "startMs": 68516,
        "endMs": 90997,
        "voiceType": "offline-espeak-placeholder"
      },
      "startMs": 67816,
      "endMs": 91998,
      "durationMs": 24182,
      "headline": "Fetch → Decode → Execute",
      "kicker": "SIMPLIFIED INSTRUCTION CYCLE",
      "labels": [
        "01 Fetch",
        "02 Decode",
        "03 Execute"
      ],
      "accessibility": {
        "visualDescription": "Instruction cards travel across three animated processing phases."
      },
      "cues": [
        {
          "id": "enter",
          "atMs": 0,
          "action": "reveal",
          "target": "headline"
        },
        {
          "id": "cue-01",
          "atMs": 6046,
          "action": "highlight",
          "target": "01 Fetch"
        },
        {
          "id": "cue-02",
          "atMs": 13058,
          "action": "highlight",
          "target": "02 Decode"
        },
        {
          "id": "cue-03",
          "atMs": 20071,
          "action": "highlight",
          "target": "03 Execute"
        }
      ]
    },
    {
      "id": "scene-05",
      "order": 5,
      "part": "01",
      "title": "Cores aur threads",
      "mode": "2D",
      "visualTemplate": "cores",
      "narration": {
        "text": "Core ek independent execution capability wala processing unit hai. Suitable workloads mein multiple cores parallel kaam kar sakte hain. Hardware threads ek core ke resources share kar sakte hain. Isliye do threads ko do complete physical cores ke barabar nahi samajhna chahiye.",
        "startMs": 92698,
        "endMs": 113898,
        "voiceType": "offline-espeak-placeholder"
      },
      "startMs": 91998,
      "endMs": 114898,
      "durationMs": 22900,
      "headline": "Cores ≠ Threads",
      "kicker": "PARALLEL WORKLOAD MODEL",
      "labels": [
        "Physical cores",
        "Hardware threads",
        "Shared resources"
      ],
      "accessibility": {
        "visualDescription": "Animation comparing four physical cores with logical task lanes."
      },
      "cues": [
        {
          "id": "enter",
          "atMs": 0,
          "action": "reveal",
          "target": "headline"
        },
        {
          "id": "cue-01",
          "atMs": 5725,
          "action": "highlight",
          "target": "Physical cores"
        },
        {
          "id": "cue-02",
          "atMs": 12366,
          "action": "highlight",
          "target": "Hardware threads"
        },
        {
          "id": "cue-03",
          "atMs": 19007,
          "action": "highlight",
          "target": "Shared resources"
        }
      ]
    },
    {
      "id": "scene-06",
      "order": 6,
      "part": "01",
      "title": "Clock speed ka sach",
      "mode": "2D",
      "visualTemplate": "clock",
      "narration": {
        "text": "CPU clock frequency cycles per second dikhati hai. Ek gigahertz ka matlab roughly ek billion clock cycles per second hai. Lekin higher gigahertz se har application mein better performance guaranteed nahi hoti. Architecture, cache, workload aur thermal limits bhi matter karte hain.",
        "startMs": 115598,
        "endMs": 137041,
        "voiceType": "offline-espeak-placeholder"
      },
      "startMs": 114898,
      "endMs": 138041,
      "durationMs": 23143,
      "headline": "GHz is not the whole story",
      "kicker": "PERFORMANCE BASICS",
      "labels": [
        "Clock cycles",
        "Architecture",
        "Thermal limits"
      ],
      "accessibility": {
        "visualDescription": "Animated waveform and clock pulses with GHz caveat."
      },
      "cues": [
        {
          "id": "enter",
          "atMs": 0,
          "action": "reveal",
          "target": "headline"
        },
        {
          "id": "cue-01",
          "atMs": 5786,
          "action": "highlight",
          "target": "Clock cycles"
        },
        {